{
  "$schema": "https://json-schema.org/draft/2020-12/schema",
  "$id": "https://raw.githubusercontent.com/api-evangelist/woocommerce/refs/heads/main/json-schema/woocommerce-rest-api-address-schema.json",
  "title": "Address",
  "description": "Billing or shipping address associated with a customer or order.",
  "type": "object",
  "properties": {
    "first_name": {
      "type": "string",
      "description": "First name.",
      "example": "Example Name"
    },
    "last_name": {
      "type": "string",
      "description": "Last name.",
      "example": "Example Name"
    },
    "company": {
      "type": "string",
      "description": "Company name.",
      "example": "string-value"
    },
    "address_1": {
      "type": "string",
      "description": "Address line 1.",
      "example": "string-value"
    },
    "address_2": {
      "type": "string",
      "description": "Address line 2.",
      "example": "string-value"
    },
    "city": {
      "type": "string",
      "description": "City name.",
      "example": "string-value"
    },
    "state": {
      "type": "string",
      "description": "ISO code or name of the state, province, or district.",
      "example": "string-value"
    },
    "postcode": {
      "type": "string",
      "description": "Postal code.",
      "example": "string-value"
    },
    "country": {
      "type": "string",
      "description": "ISO 3166-1 alpha-2 country code.",
      "example": "string-value"
    },
    "email": {
      "type": "string",
      "format": "email",
      "description": "Email address (billing only).",
      "example": "user@example.com"
    },
    "phone": {
      "type": "string",
      "description": "Phone number (billing only).",
      "example": "string-value"
    }
  }
}